dlga_lord_tell_mission:lord_mission_hunt_down_fugitive_told|Ich habe da eine Sache, bei der Ihr mir helfen könntet: Ein gesetzloser Schurke namens {s4} bereitet mir Schwierigkeiten. Er hat einer meiner Männer ermordet und ist seitdem auf der Flucht vor der Obrigkeit. Ich kann ihn mit seiner schändlichen Tat nicht davonkommen lassen, und so habe ich auf seinen Kopf einen Preis von 300 Dinaren ausgesetzt. Freunde des ermordeten Mannes glauben, dass dieser Mörder bei seinen Klansbrüdern in {s3} Zuflucht gefunden hat. Wenn es Euch gelingt, ihn aufzuspüren und ihn die Härte des Gesetzes spüren zu lassen, ist das Kopfgeld Euer.
dlga_lord_mission_hunt_down_fugitive_told:lord_mission_hunt_down_fugitive_accepted|Ich werde ihn aufspüren und das Gesetz vollstrecken.
dlga_lord_mission_hunt_down_fugitive_told:lord_mission_hunt_down_fugitive_rejected|Ich bin momentan zu beschäftigt, um ihm nachzujagen.
dlga_lord_mission_hunt_down_fugitive_accepted:close_window|Das ist hervorragend, {playername}. Ich und die Familie des Mannes, den er umgebracht hat, werden Euch zu Dank verpflichtet sein. Natürlich wird Euch auch das Kopfgeld gehören, wenn Ihr ihn zur Strecke bringen könnt. Wohlan, gute Jagd!
dlga_lord_mission_hunt_down_fugitive_rejected:lord_pretalk|Wir Ihr wünscht, {playername}. Vermutlich gibt es viele Kopfjäger, die sich gerne dieser Aufgabe annehmen werden ...
dlga_lord_tell_mission:lord_mission_told_kill_local_merchant|Die traurige Wahrheit ist, dass ich einem der Händler hier in {s3} eine beträchtliche Summe Geld schulde. Ich beabsichtige nicht, sie zurück zu zahlen, doch dieser großmäulige Narr hängt die Sache an die große Glocke. Er besaß sogar die Dreistigkeit, mich mit einem Beschwerdebrief an die Handelsgilden und die Banken zu bedrohen – mich! Dadurch würde er meinen guten Ruf ruinieren! Nun brauche ich eine Person, der ich vertrauen kann – jemanden, der für das ewige Schweigen dieses Mannes garantieren kann ...
dlga_lord_mission_told_kill_local_merchant:lord_mission_accepted_kill_local_merchant|Keine Sorge - ich werde ihm bald den Garaus machen.
dlga_lord_mission_told_kill_local_merchant:lord_mission_rejected|Herr, ich bin kein Meuchelmörder. Sucht Euch jemand anderen für Eure Drecksarbeit.
dlga_lord_mission_accepted_kill_local_merchant:close_window|Sehr gut. {playername}, ich vertraue in Eure Fertigkeiten und Eure Verschwiegenheit. Enttäuscht mich nicht. Nun geht und wartet auf meine Benachrichtigung. Ich werde Euch eine Nachricht schicken, wann und wo Ihr den Händler abpassen könnt. Erledigt ihn für mich, und ich werde Euch großzügig belohnen.
dlga_lord_tell_mission:lord_mission_told_meet_spy_in_enemy_town|Ich habe hier eine delikate Angelegenheit, {playername}, um die sich jemand kümmern muss ... und es fehlt mir an vertrauenswürdigen Bediensteten. Tatsache ist, dass ich einen Spion in {s13} habe, der die Vorgänge dort für mich im Auge behält und mir von allem berichtet, dass meine Aufmerksamkeit erfordert. Ich schicke jede Woche jemanden dorthin, um die Berichte des Spions abzuholen und sie mir zu überbringen. Wenn Ihr wollt, könnt Ihr diesen Auftrag übernehmen.
dlga_lord_mission_told_meet_spy_in_enemy_town:quest_meet_spy_in_enemy_town_accepted|Gegen ein bisschen Hinterlist habe ich nichts einzuwenden. Ich bin dabei.
dlga_lord_mission_told_meet_spy_in_enemy_town:quest_meet_spy_in_enemy_town_rejected|Ich muss ablehnen. Solche Nacht-und-Nebel-Aktionen sind nichts für mich.
dlga_quest_meet_spy_in_enemy_town_accepted:quest_meet_spy_in_enemy_town_accepted_response|Ausgezeichnet. Macht Euch sobald wie möglich auf den Weg nach {s13} - der Spion wird schon auf Euch warten.
dlga_quest_meet_spy_in_enemy_town_accepted_response:quest_meet_spy_in_enemy_town_accepted_2|{s13} wird schwer verteidigt. Wie kann ich mich nähern, ohne entdeckt zu werden?
dlga_quest_meet_spy_in_enemy_town_accepted_2:quest_meet_spy_in_enemy_town_accepted_response|Ihr müsst Euch listig verhalten, um nicht entdeckt zu werden. Hütet Euch vor feindlichen Burgen, Dörfern und Patrouillen, und nehmt nicht zu viele Männer mit. Wenn Ihr beim ersten Mal nicht hinein schleichen könnt, so wartet eine Weile, bis die Garnison wieder unachtsamer wird – ansonsten wird es schwierig werden, unbemerkt in die Stadt zu schleichen.
dlga_quest_meet_spy_in_enemy_town_accepted_response:quest_meet_spy_in_enemy_town_accepted_3|Wie kann ich den Spion erkennen?
dlga_quest_meet_spy_in_enemy_town_accepted_3:quest_meet_spy_in_enemy_town_accepted_response|Nachdem Ihr Euch nach {s13} hinein geschlichen habt, müsst Ihr mit der dortigen Bevölkerung sprechen. Einer von ihnen ist der Spion. Wenn Ihr glaubt, ihn gefunden zu haben, so sprecht den Satz '{s11}'. Daraufhin wird der Spion den Satz '{s12}' erwidern. So könnt Ihr Euch gegenseitig identifizieren, worauf {reg7?sie:er} Euch die Informationen geben wird, die {reg7?sie:er} in meinem Auftrag gesammelt hat.
dlga_quest_meet_spy_in_enemy_town_accepted_response:quest_meet_spy_in_enemy_town_accepted_4|Werde ich entlohnt werden?
dlga_quest_meet_spy_in_enemy_town_accepted_4:quest_meet_spy_in_enemy_town_accepted_response|Natürlich sitzt für loyale {Männer/Frauen} wie Euch mein Geldsäckel locker. Dient mir gut, {playername}, und Ihr werdet weit kommen.
dlga_quest_meet_spy_in_enemy_town_accepted_response:quest_meet_spy_in_enemy_town_accepted_end|Ich weiß, was zu tun ist. Lebt wohl, mein Fürst.
dlga_quest_meet_spy_in_enemy_town_accepted_end:lord_pretalk|Viel Glück, {playername}. Vergesst nicht, die Geheimlosung lautet '{s11}', die richtige Entgegnung ist '{s12}'. Bringt mir alle Berichte zurück, und ich werde Euch für Eure Mühen entschädigen.
dlga_quest_meet_spy_in_enemy_town_rejected:lord_pretalk|Wie Ihr wünscht, {playername}, aber ich rate Euch, nichts von alldem zu vergessen, das ich Euch über Spione erzählt habe. Sie existieren nicht, haben nie existiert, und niemand wird sie jemals finden. Vergesst das nicht.
dlga_lord_tell_mission:lord_mission_told_raid_caravan_to_start_war|Dieser Frieden mit {s13} passt mir nicht, {playername}. Wir haben diesen Schweinen viel zu lange alles durchgehen lassen. Jetzt werden sie jeden Tag stärker und ihre Arroganz kennt keine Grenzen. Wir sollten ihnen den Krieg erklären, bevor es zu spät ist! Leider sind einige der Fürsten unseres Reichs friedensgeile Hammel und blockieren eine Kriegserklärung. Schwachsinnige Feiglinge, die beim Anblick von Blut in Ohnmacht fallen.
dlga_lord_mission_told_raid_caravan_to_start_war:lord_mission_tell_raid_caravan_to_start_war_2|Ihr habt Recht, {s65}, aber was können wir tun?
dlga_lord_mission_told_raid_caravan_to_start_war:quest_raid_caravan_to_start_war_rejected_1|Ich stimmte nicht mit Euch überein, Herr. Der Frieden ist dem Krieg vorzuziehen.
dlga_lord_mission_tell_raid_caravan_to_start_war_2:lord_mission_tell_raid_caravan_to_start_war_3|Ah, endlich jemand, der mich versteht! Ich gäbe da tatsächlich etwas, das wir tun könnten, {playername}: Wir könnten sie ein bisschen provozieren. Die Hunde in {s13} sind sehr stolz auf ihre Handelskarawanen, und sie verlassen sich viel zu sehr auf sie. Sollte eine unserer Streitmächte auf ihr Territorium vordringen, und einige ihrer Karawanen überfallen, hätten sie einen guten Grund, unserem Königreich den Krieg zu erklären. Und dann müssen selbst die Feiglinge in unseren Reihen zu den Waffen greifen und sich verteidigen. Also was sagt Ihr? Seid Ihr interessiert?
dlga_lord_mission_tell_raid_caravan_to_start_war_3:quest_raid_caravan_to_start_war_accepted|Ein hervorragender Plan. Ich bin dabei.
dlga_lord_mission_tell_raid_caravan_to_start_war_3:lord_mission_tell_raid_caravan_to_start_war_4|Warum überfallt Ihr die Karawanen nicht selbst?
dlga_lord_mission_tell_raid_caravan_to_start_war_4:lord_mission_tell_raid_caravan_to_start_war_5|Nun, {playername}, einige Fürsten in unserem Königreich würden es nicht schätzen, dass jemand ohne ihre Zustimmung einen Krieg anzettelt. Sie suchen bereits nach einem Vorwand, mir das Handwerk zu legen, und wenn ich mich in diese Angelegenheit verwickeln ließe, würde man mich schwer dafür bezahlen lassen. Ihr dagegen seid jung, beliebt und wagemutig, und so könnte man es Euch durchgehen lassen. Natürlich werde ich Euch den Rücken stärken und Euer Vorgehen verteidigen. Einige Fürsten wird Euer Vorhaben sicherlich in Aufruhr versetzen, doch ich bin mir sicher, dass Euch das nicht allzu sehr grämen wird.
dlga_lord_mission_tell_raid_caravan_to_start_war_5:quest_raid_caravan_to_start_war_accepted|Dann werde ich mich aufmachen und diese Karawanen überfallen!
dlga_lord_mission_tell_raid_caravan_to_start_war_5:quest_raid_caravan_to_start_war_rejected_2|Das gefällt mir nicht. Sucht Euch jemand anderen, der als Sündenbock für Eure Ränkespiele abgibt.
dlga_quest_raid_caravan_to_start_war_accepted:close_window|Sehr gut! Vergesst aber nicht, dass Ihr mindestens {reg13} Karawanen besiegen und ausplündern müsst, damit diesen Narren in {s13} die Hutschnur reißt. Kehrt nach Erfüllung Eurer Aufgabe zu mir zurück, und seid vor ihren Patrouillen auf der Hut. Sollten Sie Euch erwischen, ist unser Plan zweifelsfrei zum Scheitern verdammt, und Ihr werdet für lange Zeit in ihren Kerkern darben. Viel Glück und gute Jagd!
dlga_quest_raid_caravan_to_start_war_rejected_1:lord_pretalk|Ah, dieser Ansicht seid Ihr also? Aber wie lange würde Euer kostbarer Frieden anhalten? Nicht lange, glaubt mir.
dlga_quest_raid_caravan_to_start_war_rejected_2:lord_pretalk|Hmmm. Wir Ihr wünscht, {playername}. Ich dachte, in Euch ein Feuer brennen zu sehen, aber anscheinend habe ich mich geirrt.
dlga_lord_tell_mission:lord_mission_told.1|Nun, einige Leibeigene, die auf meinen Feldern in {s4} arbeiteten, sind davongelaufen. Ich lasse diese Schweine meine Felder pflügen und meine Häuser pachten, und so zahlen sie mir meine Großzügigkeit zurück! Ich hörte, dass sie so schnell wie möglich nach {s3} laufen, und dass sie sich in drei Gruppen aufgeteilt haben, um der Verhaftung zu entgehen. Fangt alle drei Gruppen ein und bringt sie unter Einsatz sämtlicher Mittel nach {s4} zurück. Für ihren Fluchtversuch sollte ich sie hängen lassen, doch für die kommende Ernte brauchen wir jeden Mann. Dieses Mal werde ich sie also mit einer gehörigen Tracht Prügel davonkommen lassen.
dlga_lord_tell_mission:lord_tell_mission_follow_spy|Ich habe verlässliche Informationen, dass ein Mann in dieser Stadt tatsächlich ein Spion ist. Für seine Dreistigkeit sollte ich ihn hängen lassen, doch wir glauben, dass er die Stadt bald verlassen wird, um sich mit seinem Herrn zu treffen – dem Mann, dem der Spion seine Informationen übergibt. Der Spion selbst ist eher unwichtig, doch sein Herr ist ein gefährlicher Mann, aus dem wir viel herausbekommen würden, könnten wir ihm nur habhaft werden ...
dlga_lord_tell_mission_follow_spy:lord_tell_mission_follow_spy_2|Wartet hier, bis der Spion die Stadt verlässt. Folgt ihm dann im Geheimen zum Treffpunkt. Ihr müsst größte Vorsicht walten lassen, damit Euch der Spion nicht entdeckt, denn sonst wird er faules Spiel vermuten und zurückkehren. Wenn sein Herr erscheint, müsst Ihr ihm einen Hinterhalt legen, und die beiden dann zu mir zurückbringen. Und zwar lebendig!
dlga_lord_tell_mission_follow_spy_2:lord_tell_mission_follow_spy_accepted|Ich werde es machen, {s65}.
dlga_lord_tell_mission_follow_spy_2:lord_tell_mission_follow_spy_rejected|Nein, dieses Herumschleichen ist nichts für mich.
dlga_lord_tell_mission_follow_spy_accepted:close_window|Gut, Ihr werdet sicherlich gute Arbeit leisten. Einer meiner Männer wird Euch auf den Spion aufmerksam machen, wenn er sich auf den Weg macht - so werdet Ihr wissen, wem Ihr zu folgen habt. Vergesst nicht, ich will sie beide - und ich will sie lebendig!
dlga_lord_tell_mission_follow_spy_rejected:lord_pretalk|Eine Schande. Nun denn, weitergemacht, {playername} ...
dlga_lord_tell_mission:lord_tell_mission_capture_enemy_hero|Ich habe eine schwierige Aufgabe, {playername}, und Ihr könntet dafür wie geschaffen sein. Jemand muss für mich einen der Adligen von {s13} fangen und zu mir bringen. Ich werde ihn gegen einen meiner Verwandten austauschen, der von {s13} gefangen gehalten wird. Der Auftrag an sich ist sehr einfach, doch jeder Fürst wird von einer Leibgarde umgeben. Seid Ihr für einen Kampf zu haben?
dlga_lord_tell_mission_capture_enemy_hero:lord_tell_mission_capture_enemy_hero_accepted|Erachtet es als erledigt, {s65}.
dlga_lord_tell_mission_capture_enemy_hero:lord_tell_mission_capture_enemy_hero_rejected|{s65}, ich muss ablehnen Ich bin kein Entführer.
dlga_lord_tell_mission_capture_enemy_hero_accepted:close_window|Ich mag Eure Tatkraft! Geht hin und bringt mir einen unserer Feinde. Ob Eurer Rückkehr werde ich in meiner Halle auf Euer Wohl anstoßen! Und Euch natürlich für Eure Bemühungen belohnen ...
dlga_lord_tell_mission_capture_enemy_hero_rejected:lord_pretalk|Offensichtlich fehlt Euch der Eifer, den ich in Euch zu sehen geglaubt hatte. Nun gut, {playername}, ich werde jemand anderen für diese Aufgabe finden.
dlga_lord_tell_mission:lord_tell_mission_lend_companion|Momentan habe ich keine Aufgabe für Euch, doch Euer Gefährte {s3} ist wahrlich geschickt, und ich benötige jemand mit {reg3?seinen:ihren} Talenten. Würdet Ihr mir {reg3?sie:ihn} für eine Weile ausleihen?
dlga_lord_tell_mission_lend_companion:lord_tell_mission_lend_companion_2|Wie lange würdet Ihr {reg3?sie:ihn} benötigen?
dlga_lord_tell_mission_lend_companion_2:lord_mission_lend_companion_told|Nur ein paar Tage, doch höchstens eine Woche.
dlga_lord_mission_lend_companion_told:lord_tell_mission_lend_companion_accepted|Dann werde ich Euch {s3} für eine Woche überstellen.
dlga_lord_mission_lend_companion_told:lord_tell_mission_lend_companion_rejected|Es tut mir Leid, aber ich kann keine ganze Woche ohne {s3} auskommen.
dlga_lord_tell_mission_lend_companion_accepted:close_window|Ich kann Euch gar nicht genug danken, {playername}. Sorgt Euch nicht, Euer Gefährte wirkt in gebührender Eile zu Euch zurückkehren.
dlga_lord_tell_mission_lend_companion_rejected:lord_pretalk|Nun, das ist wirklich verdammt schade, aber ich kann Euch oder {s3} wohl nicht zum Einverständnis zwingen. Dann muss ich es halt ohne Hilfe schaffen.
dlga_lord_tell_mission:lord_tell_mission_collect_debt|Vor langer Zeit lieh ich {s3} eine beträchtliche Summe Geld, {reg4} Dinare, um genau zu sein. Er hätte es innerhalb eines Monats zurückzahlen sollen, doch bis jetzt habe ich nicht eine Münze gesehen. Wenn Ihr meine Schulden für mich bei ihm eintreiben könntet, wäre ich Euch sehr dankbar. Ich würde Euch sogar den Fünften für Eure Mühen überlassen. Was meint Ihr?
dlga_lord_tell_mission_collect_debt:lord_tell_mission_collect_debt_2|{s65}, wisst Ihr, wo ich {s3} finden kann?
dlga_lord_tell_mission_collect_debt_2:lord_tell_mission_collect_debt_3|Wenn Ihr sofort aufbrecht, solltet Ihr ihn in {s4} finden können. Ich habe keinen Zweifel daran, dass sein Verhalten ihn gebührend beschämt und er Euch daher alles Geld geben wird, das er mir schuldet.
dlga_lord_tell_mission_collect_debt_3:lord_tell_mission_collect_debt_accepted|Dann werde ich an Euer Statt mit {s3} sprechen.
dlga_lord_tell_mission_collect_debt_3:lord_tell_mission_collect_debt_rejected|Vergebt mir, {s65}, aber ich bezweifle, dass ich erfolgreicher als Ihr selbst sein würde.
dlga_lord_tell_mission_collect_debt_accepted:close_window|Durch Eure Zusage habt Ihr mich sehr glücklich gemacht, {playername}. Bitte, sprecht mit {s3} und verlasst ihn nicht ohne mein Geld.
dlga_lord_tell_mission_collect_debt_rejected:lord_pretalk|Vielleicht nicht, {playername}. Dieses Geld werde ich vermutlich nie zurückbekommen ...
dlga_lord_tell_mission:lord_tell_mission_incriminate_commander|Ich sage Euch, dieser flennende Narr {s13} ist nicht zur Herrschaft über {s14} geeignet. Jeder weiß, dass er augenblicklich seiner Ländereien beraubt werden würde, wäre da nicht {s15}, einer seiner treuen Vasallen. Solange ihm dieser Vasall zur Seite steht, wird es sehr schwer, ihn zu schlagen. Deshalb muss {s15} aus dem Weg geschafft werden, und ich weiß auch schon wie ... mit Eurer Hilfe natürlich.
dlga_lord_tell_mission_incriminate_commander:lord_tell_mission_incriminate_commander_2|{s66}, ich bin ganz Ohr.
dlga_lord_tell_mission_incriminate_commander:lord_tell_mission_incriminate_commander_rejected|Ich möchte nicht in unehrenhafte Handlungen gegen {s15} hineingezogen werden.
dlga_lord_tell_mission_incriminate_commander_rejected:lord_pretalk|Unehrenhaft? Pfui! Und ich hoffte, auf Euch zählen zu können, {playername}, doch Ihr habt mir gezeigt, was für ein Narr ich gewesen bin. Ich werde jemanden finden müssen, auf dessen Loyalität ich vertrauen kann.
dlga_lord_tell_mission_incriminate_commander_2:lord_tell_mission_incriminate_commander_3|Ich werde {s15} einen gefälschten Brief mit meinem Siegel schreiben, der impliziert, dass er mit uns eine Verschwörung zum Sturze des Herrschers von {s14} betreibt – zu meinen Gunsten. Wenn wir {s13} von der Echtheit des Briefes überzeugen können, wird er mit {s15} kurzen Prozess machen. Natürlich besteht die Schwierigkeit darin, {s13} von der Echtheit des Briefes zu überzeugen ...
dlga_lord_tell_mission_incriminate_commander_3:lord_tell_mission_incriminate_commander_4|Bitte, {s65}, fahrt fort ...
dlga_lord_tell_mission_incriminate_commander_3:lord_tell_mission_incriminate_commander_rejected|Nein, ich werde meine Ehre nicht mit diesem unehrenhaften Ränkespiel besudeln.
dlga_lord_tell_mission_incriminate_commander_4:lord_tell_mission_incriminate_commander_5|Und an dieser Stelle kommt Ihr ins Spiel: Ihr werdet den Brief zu {s14} bringen, und ihn dann von einem Eurer Soldaten an {s15} übergeben lassen. Ich werde der Stadtgarnison über einen meiner Spione einen Tipp geben, damit Euer Mann unterwegs verhaftet wird. Die Wachen werden den Brief finden und ihn {s13} überreichen. Natürlich werden Sie Euren Mann foltern, um die Wahrheit aus ihm heraus zu bekommen, doch er weiß ja nur, dass Ihr ihm befohlen habt, den Brief unter größter Geheimhaltung an {s15} zu überbringen. {s13} weiß, dass Ihr mir dient, und dieser Narr wird unserer Scharade mit Sicherheit Glauben schenken.
dlga_lord_tell_mission_incriminate_commander_5:lord_tell_mission_incriminate_commander_7|Ist das alles?
dlga_lord_tell_mission_incriminate_commander_7:lord_tell_mission_incriminate_commander_8|Da gäbe es noch eine Sache ... euer Bote muss vertrauenswürdig sein. Wenn Ihr den Brief von einem einfachen Bauern befördern ließet, einer ersetzbaren Person, könnte {s13} eine Verschwörung vermuten. Er mag zwar das Hirnschmalz einer Schnecke haben, doch selbst eine Schnecke kann eins und eins zusammenzählen. Gebt den Brief also einer ranghohen Person. Vielleicht einem Eurer {s9}.
dlga_lord_tell_mission_incriminate_commander_8:lord_tell_mission_incriminate_commander_9|Was? Ich kann doch keinen meiner treuen {s9} in den Tod schicken!
dlga_lord_tell_mission_incriminate_commander_8:lord_tell_mission_incriminate_commander_fin|Dann werde ich einen {s8} schicken.
dlga_lord_tell_mission_incriminate_commander_9:lord_tell_mission_incriminate_commander_10|Kommt schon, {playername}. Es gibt Momente für Sentimentalität, aber dies ist keiner von ihnen. Glaubt mir, Ihr würdet großzügig entschädigt werden. Ist es nicht der Sinn und Zweck von Soldaten, auf unser Geheiß hin zu sterben?
dlga_lord_tell_mission_incriminate_commander_10:lord_tell_mission_incriminate_commander_fin|Wohlan, es bleibt bei einem {s8}.
dlga_lord_tell_mission_incriminate_commander_10:lord_tell_mission_incriminate_commander_rejected|Nein, ich werde keinen meiner treuen Mannen opfern.
dlga_lord_tell_mission_incriminate_commander_fin:lord_pretalk|Ihr ahnt nicht, {playername}, wie sehr es mir erfreut, dies zu hören. Ihr räumt eines der größten Hindernisse auf meinem Weg zur Seite. Hier ist der Brief sowie 300 Dinar für Eure Ausgaben. Vergesst nicht, solltet Ihr Erfolg haben, gibt es noch mehr zu verdienen. Viel, viel mehr ...
dlga_lord_tell_mission:lord_mission_told.2|Bei einem kürzlichen Scharmützel mit dem Feind ist eine Gruppe meiner Soldaten in Gefangenschaft geraten. Gott sei Dank konnte ein Gefangenenaustausch vereinbart werden, doch wir sollen ihnen ebenso viele Gefangene von vergleichbarem Rang bringen – Gefangene, die ich momentan nicht habe. Aus diesem Grund benötige ich einen guten {Mann/Krieger}, der mir {reg1} {s3} als Gefangene bringt, die ich gegen meine Leute austauschen kann.
dlga_lord_tell_mission:lord_pretalk|Nein, {playername}. Momentan benötige ich Eure Hilfe nicht.
dlga_lord_mission_told:lord_mission_accepted|Ihr könnt auf mich zählen, {s65}.
dlga_lord_mission_told:lord_mission_rejected|Ich fürchte, einen derartigen Auftrag kann ich momentan nicht akzeptieren.
dlga_lord_mission_accepted:close_window|Hervorragend, {playername}, ganz ausgezeichnet. Ich habe völliges Vertrauen in Euch.
dlga_lord_mission_rejected:close_window|Ach, tatsächlich? Nun, vermutlich seid Ihr der Aufgabe einfach nicht gewachsen. Ich werde mich nach jemand mit mehr Mumm in den Knochen umsehen müssen.
dlga_lord_talk:lord_leave_prison|Ich muss jetzt gehen.
dlga_lord_talk:lord_leave|Diese Audienz ist beendet. Ich gehe jetzt.
dlga_lord_talk:lord_leave.1|Ich muss mich nun empfehlen.
dlga_lord_leave:lord_leave_give_quest|Bevor Ihr geht, {playername}, möchte ich Euch noch um etwas bitten ... wir mögen in diesem Krieg zwar Feinde sein, doch ich hoffe inständig, dass wir uns gegenseitig trotzdem mit Respekt behandeln können. Deshalb dachte ich mir, dass Ihr gütig genug wäret, mir bei einer wichtigen Angelegenheit zu helfen.
dlga_lord_leave_give_quest:enemy_lord_tell_mission|Ich höre zu.
dlga_enemy_lord_tell_mission:lord_mission_told|Einer meiner Freunde, ein altgedienter Krieger, ist sehr krank. Ein Übel hat eine alte Kriegswunde infiziert, und wenn sich nicht bald ein Wundarzt um ihn kümmert, wird er sicherlich sterben. Dieser Mann steht mir nahe, {playername}, doch er ist stur wie ein Esel, und lässt keinen meiner Ärzte an sich heran, weil er ihnen nicht traut. Ich hörte, dass Ihr einen fähigen Wundarzt bei Euch habt, Wenn Ihr ihn meinen Freund behandeln lassen würdet, könnte {reg3?sie:er} ihn vielleicht überreden, einer Operation zuzustimmen. Ich flehe Euch an - tief  würde ich in Eurer Schuld stehen, wenn Ihr mir diese Bitte gewährtet.
dlga_enemy_lord_tell_mission:close_window|ERROR: MATCHED WITH QUEST: {s7}.
dlga_lord_leave_prison:close_window|Wir werden uns wiedersehen.
dlga_lord_leave:close_window|Natürlich, {playername}. Lebt wohl.
dlga_lord_leave:close_window.1|Ich wünsche Euch eine gute Reise, {playername}.
dlga_lord_leave:close_window.2|Jawohl, ja. Lebt wohl.
dlga_lord_leave:close_window.3|Wir werden uns wiedersehen.
dlga_member_chat:lady_journey_1|Genießt Ihr die Reise, {s65}?
dlga_lady_journey_1:close_window|Ja, es geht mir gut, {playername}. Ich danke Euch für Eure Aufmerksamkeit.
dlga_start:lady_qst_duel_for_lady_succeeded_1|Oh {playername}, wie glücklich ich bin, Euch wieder zu sehen! Ich hörte, Ihr gabt diesem bösen {s13} eine wohl verdiente Lektion. Hoffentlich wird er diese Erniedrigung niemals vergessen. Ich habe eine Belohnung für Euch, doch ich fürchte, im Vergleich zu Euren Taten ist sie gering.
dlga_lady_qst_duel_for_lady_succeeded_1:lady_qst_duel_for_lady_succeeded_2|Oh, das wird einfach reichen müssen
dlga_lady_qst_duel_for_lady_succeeded_1:lady_qst_duel_for_lady_succeeded_2.1|{s66}, das ist viel zu viel!
dlga_lady_qst_duel_for_lady_succeeded_1:lady_qst_duel_for_lady_succeeded_2.2|Ach bitte, {s65}, eine Belohnung ist unnötig!
dlga_lady_qst_duel_for_lady_succeeded_2:lady_pretalk|{s10}
dlga_start:lady_qst_duel_for_lady_failed|{playername}, man sagte mir, dass Ihr von {s13} Genugtuung einfordertet, um meine Unschuld zu beweisen. Dies war eine noble Geste, und ich danke Euch für Eure Bemühungen.
dlga_lady_qst_duel_for_lady_failed:lady_qst_duel_for_lady_failed_2|{s65}, ich flehe Euch an, vergebt mir meine Niederlage ...
dlga_lady_qst_duel_for_lady_failed_2:lady_pretalk|Es spielt keine Rolle, oh {playername}. Ihr habt es versucht. Die Wahrheit kann nicht mit der Schneide eines Schwertes bewiesen werden, doch Ihr habt Euer Leben bewusst für meine Ehre aufs Spiel gesetzt. Dies alleine wird viele von meiner Unschuld überzeugen.
dlga_start:lady_escort_lady_succeeded|Danke, dass Ihr mich hierher eskortiert habt, {playername}. Bitte akzeptiert dieses Geschenk als Zeichen meines Danks. Ich hoffe, dass sich unsere Wege in der Zukunft wieder kreuzen werden.
dlga_lady_escort_lady_succeeded:close_window|Es war mir eine Ehre, Euch zu dienen, {s65}.
dlga_start:lady_generic_mission_succeeded|Oh, {playername}, Ihr habt ihn mir zurückgebracht! Ich danke Euch so sehr, dass Ihr meinen Ehemann gerettet habt. Bitte, nehmt dies als bescheidene Bezahlung für Eure noblen Dienste.
dlga_lady_generic_mission_succeeded:lady_pretalk|{s65}, ich bin Euch stets gerne zu Diensten.
dlga_start:lady_premeet|Ihr kommt mir nicht bekannt vor ...
dlga_lady_premeet:lady_meet|Ich bin {playername}.
dlga_lady_premeet:lady_meet.1|Mein Name lautet {playername}. Stehe zu Diensten.
dlga_lady_meet:lady_meet_end|{playername}? Ich glaube nicht, jemals von Euch gehört zu haben.
dlga_lady_meet_end:lady_talk|Kann ich Euch mit etwas behilflich sein?
dlga_start:lady_talk|Ja?
dlga_lady_pretalk:lady_talk|Noch etwas?
dlga_lady_talk:lady_ask_for_quest|Gibt es etwas, mit dem ich Eure Gunst gewinnen könnte?
dlga_lady_ask_for_quest:lady_pretalk|Momentan habe ich keine anderen Aufgaben für Euch.
