dlga_lord_ask_to_collect_debt:lord_ask_to_collect_debt_2|Oh. Wohlan, {s1} hat mir vor einer Weile tatsächlich etwas Geld geliehen, aber da ich ihm in der Vergangenheit viele Gefälligkeiten erwiesen habe, betrachte ich dieses Geld als angemessene Entschädigung dafür.
dlga_lord_ask_to_collect_debt_2:convince_begin|{s1} sieht es als Schulden an. Er bat mich, an seiner Statt mit Euch darüber zu sprechen.
dlga_lord_ask_to_collect_debt_2:lord_pretalk|Dann werde ich die Angelegenheit nicht weiter verfolgen.
dlga_convince_accept:close_window|Meine Schulden bei {s8} sind schon lange überfällig und waren für mich Ursache großen Unbehagens. Ich danke Euch, dass Ihr ihm das Geld für mich überbringt. Bitte gebt ihm diese {reg10} Dinare und dankt ihm an meiner Stelle.
dlga_lord_talk:lord_ask_to_make_peace|Ich bitte Euch, {s64}, es ist an der Zeit, diesen Krieg zwischen {s12} und {s13} zu beenden.
dlga_lord_ask_to_make_peace:lord_ask_to_make_peace_2|Was? Ihr habt Euch wohl verhört, {playername}. Ein Krieg wird von keinem Beteiligten schnell vergessen, und ich habe ein äußerst gutes Gedächtnis. Warum sollte ich daran Interesse haben, einen Frieden mit diesen Hunden zu vereinbaren?
dlga_lord_ask_to_make_peace_2:convince_begin|Vielleicht kann ich Euch überzeugen ...
dlga_lord_ask_to_make_peace_2:lord_pretalk|Wir Ihr wünscht, der Frieden kann noch ein bisschen länger warten ....
dlga_convince_accept:close_window.1|Ihr ... Ihr habt mich überzeugt, {playername}. Wohlan, Ihr habt meinen Segen, {s14} ein Friedensangebot zu überbringen. Ich kann Euch nicht garantieren, dass es akzeptiert werden wird, aber sollte wider Erwarten das Gegenteil zutreffen, so werde ich zu meinem Angebot stehen.
dlga_lord_talk:lord_challenge_duel_for_lady|Ich möchte, dass Ihr Eure Anschuldigungen gegen {s1} widerruft.
dlga_lord_challenge_duel_for_lady:lord_challenge_duel_for_lady_2|Welche Anschuldigungen? Jeder weiß doch, dass sie, während ihr Vermählter nicht zu Hause weilt, ihre Stallburschen und jeden Kerl besteigt, den sie in die Finger bekommen kann. Ich wiederhole lediglich das Gespött der Straße.
dlga_lord_challenge_duel_for_lady_2:lord_challenge_duel_for_lady_3|Herr, Ihr werdet diese Lügen widerrufen oder meine Klinge zu schmecken bekommen!
dlga_lord_challenge_duel_for_lady_2:lord_pretalk|Wenn Ihr das sagt ...
dlga_lord_challenge_duel_for_lady_3:close_window|Fordert Ihr mich zu einem Duell heraus? Das ist ja putzig! Wie Ihr wollt, {playername}, Euren Kopf zu spalten wird mir eine gute Übung sein.
dlga_lord_talk:lord_message_delivered|Ich bringe eine Botschaft von {s9}.
dlga_lord_message_delivered:lord_pretalk|Ach? Lasst mich einmal sehen ... Wohlan, Ihr habt gut getan, {playername}, mir dies zu bringen. Nehmt mein Siegel als Zeichen meines Empfangs, und grüßt {s9} für mich, wenn Ihr ihn seht.
dlga_lord_talk:lord_message_delivered_enemy|Ich bringe eine Botschaft von {s9}.
dlga_lord_message_delivered_enemy:close_window|Ach? Lasst mich einmal sehen ... Wohlan, Ihr habt gut getan, {playername}, mir dies zu bringen. Nehmt mein Siegel als Zeichen meines Empfangs, und seid Euch meines Danks gewiss.
dlga_lord_talk:lord_deliver_message_prisoner|Ich bringe eine Botschaft von {s11}.
dlga_lord_deliver_message_prisoner:lord_deliver_message_prisoner_2|Das ist zu schön, um wahr zu sein! Oh, ich danke Euch, {playername} – Ihr seid zu gütig! Dank Euch gibt es in diesem kargen Gemäuer wieder etwas Hoffnung. Vielleicht werde ich Euch eines Tages dafür belohnen können.
dlga_lord_deliver_message_prisoner_2:lord_deliver_message_prisoner_2a|Es war mir eine Ehre, {s65}.
dlga_lord_deliver_message_prisoner_2a:close_window|Ihr ahnt ja nicht, wie dankbar ich Euch bin, {playername}. Habt tausendfachen Dank!
dlga_lord_deliver_message_prisoner_2:lord_deliver_message_prisoner_2b|Grämt Euch nicht, {s65}. Wenn Ihr wieder frei seid, werdet Ihr dazu genügend Gelegenheiten haben.
dlga_lord_deliver_message_prisoner_2b:close_window|Ha, natürlich, {playername} – da habt Ihr Recht. Ich bin Euch auf ewig dankbar.
dlga_lord_talk:lord_rescue_by_replace_offer|Fürchtet Euch nicht, ich komme zu Eurer Rettung.
dlga_lord_rescue_by_replace_offer:lord_rescue_by_replace_offer_2|Mein Gott, sprecht Ihr die Wahrheit? Wie lautet Euer Plan?
dlga_lord_rescue_by_replace_offer_2:lord_rescue_by_replace_offer_3|Eine einfache List, {s65}: Wir tauschen die Gewänder, und ich nehme Euren Platz hier im Kerker ein, während Ihr an meiner Statt in die Freiheit entkommt. Ich habe die Wachen fürstlich bestochen, womit sie in der nächsten Schänke sicherlich kräftig gezecht haben. Mit etwas Glück werden sie in Bälde derart fürchterlich betrunken sein, dass sie ihre eigenen Mütter nicht mehr erkennen würden, geschweige denn, uns voneinander zu unterscheiden. Zumindest nicht, bis Ihr in Sicherheit seid.
dlga_lord_rescue_by_replace_offer_3:lord_rescue_by_replace_offer_4|Hmmm, das könnte in der Tat funktionieren ... Doch was wird Euch widerfahren, oh {Freund/Fürstin}? Den Wachen wird unsere List sicherlich nicht gefallen. Am Ende würdet Ihr einige Zeit allein in dieser Zelle verbringen müssen.
dlga_lord_rescue_by_replace_offer_4:lord_rescue_by_replace_offer_5a|Sorgt Euch nicht um mich, {s65} – ich fühle mich hier schon fast wie zu Hause.
dlga_lord_rescue_by_replace_offer_4:lord_rescue_by_replace_offer_5b|So lange mir letztendlich eine gebührende Belohnung winkt, wird es mir gut ergehen.
dlga_lord_rescue_by_replace_offer_5a:lord_rescue_by_replace_offer_6|Ihr seid wahrlich tapfer, ich werde Eure Taten niemals vergessen.
dlga_lord_rescue_by_replace_offer_5b:lord_rescue_by_replace_offer_6|Natürlich, oh {Freund/Fürstin}! Sucht mich auf, wenn Ihr Eure Freiheit wiedererlangt habt, und vielleicht werde ich in der Lage sein, meine Schuld bei Euch zu begleichen.
dlga_lord_rescue_by_replace_offer_6:close_window|Schnell, {s65}, lasst uns die Gewänder tauschen. Ihr solltet diesen Ort schnell verlassen.
dlga_lord_talk:lord_ask_pardon_after_oath_renounced|{s66}, ich möchte meinen alten Treueschwur an {s4} wieder herstellen.
dlga_lord_ask_pardon_after_oath_renounced:lord_pretalk|Es steht mir nicht zu, über eine solch bedeutende Sache zu entscheiden, {playername}. Ihr solltet {s4} aufsuchen. Solch Gnade kann nur er gewähren.
dlga_lord_ask_pardon_after_oath_renounced:lord_ask_pardon_terms|{s11}.
dlga_lord_ask_pardon_terms:lord_pretalk|Wie Ihr wünscht, {s65}. Ich akzeptiere Euer Urteil.
dlga_lord_ask_pardon_terms:lord_pretalk.1|Eine wahre Schande, {s65}. Eine Schande!
dlga_lord_ask_pardon_terms:lord_pretalk.2|Nun gut, zieht dahin und sterbt ohne mich.
dlga_lord_ask_pardon_terms:lord_ask_pardon_after_renounce_peace|Jawohl, ich bin bereit.
dlga_lord_ask_pardon_terms:lord_ask_pardon_terms_rejected|Im Nachhinein möchte ich lieber doch nicht in Euren Diensten stehen.
dlga_lord_ask_pardon_terms:lord_ask_pardon_after_renounce_peace.1|Jawohl, mit diesen Bedingungen bin ich einverstanden.
dlga_lord_ask_pardon_terms:lord_ask_pardon_terms_rejected.1|Dieser Preis ist zu hoch, {s65}. Ich muss ablehnen.
dlga_lord_ask_pardon_after_renounce_peace:lord_pretalk|Hervorragend. Obwohl Ihr Euch von uns entfernt hattet, {playername}, bringt es Freude in unsere Herzen, dass Ihr auf den richtigen Pfad zurückgefunden habt. Hiermit stelle ich Euren Treueschwur an mich wieder her. Erhebt Euch erneut als ehrenhaftes Mitglied meiner Tafelrunde.
dlga_lord_ask_pardon_terms_rejected:close_window|Dann geht aus meinen Augen, Ihr Verräter! Fort mich Euch, und kommt niemals zurück!
dlga_lord_talk:lord_ask_pardon|Ich möchte Frieden mit {s4} schließen.
dlga_lord_ask_pardon:lord_pretalk|Tatsächlich, {playername}? Dann fallt in Euer Schwert und schenkt uns Frieden.
dlga_lord_ask_pardon:lord_pretalk.1|{playername}, kein König in Caldria würde einen dauerhaften Frieden mit Euch akzeptieren, denn Ihr als {Fürst/Fürstin} ohne Herr, ohne Ländereien in Eurem Namen und ohne Zugehörigkeit zu einem Königreich seid dazu ein zu unbeschriebenes Blatt.
dlga_lord_ask_pardon:lord_ask_pardon_2|Hmmm. Ich könnte meine beachtlichen Einfluss dazu verwenden, für Euch um Gnade zu bitten, {playername}. Es gibt jedoch einige, die Euch als Feind sehen, und sie werden nicht zufrieden sein, bevor Ihr ihnen einen Tribut entrichtet. Insgesamt müsst Ihr nicht weniger als {reg16} Dinare aufbringen, um Euch Freunde in {s4} zu machen.
dlga_lord_ask_pardon_2:lord_ask_pardon_tribue_accept|Ich habe das Geld hier. {reg16} Dinare.
dlga_lord_ask_pardon_2:lord_ask_pardon_tribue_deny|Ich fürchte, ich kann nicht so viel bezahlen.
dlga_lord_ask_pardon_tribue_accept:close_window|Hervorragend, {playername}. Mit dem Geld werde ich jene überzeugen, die sich gegen Eure Begnadigung sträuben, und sicherlich wird sich schon bald herumsprechen, dass Ihr nicht länger ein Feind von {s4} seid.
dlga_lord_ask_pardon_tribue_deny:lord_pretalk|Dann kann ich nichts für Euch tun, {playername}. Kein Geld, keine Begnadigung.
dlga_lord_talk:lord_active_mission_1|Wegen der Aufgabe, die Ihr mir gegeben hattet ...
dlga_lord_talk:lord_pay_mercenary|{s67}, ich fordere demütig die wöchentliche Bezahlung für meine Dienste ein.
dlga_lord_pay_mercenary:lord_pay_mercenary_2|Hmmm, lasst mich einmal sehen ... meinen Büchern zufolge schulden wir Euch {reg8} Dinar für Eure Arbeit. Bitte sehr.
dlga_lord_pay_mercenary_2:lord_pretalk|Ich danke Euch, Herr.
dlga_lord_talk:lord_request_mission_ask|Habt Ihr Aufgaben, die ich für Euch erfüllen könnte?
dlga_lord_talk:lord_ask_enter_service|{s66}, ich bin gekommen, um Euch mein Schwert als treuer Vasall darzubieten!
dlga_lord_talk:lord_ask_enter_service.1|{s66}, ich möchte einen Treueschwur auf Euch leisten und für Eure Ehre kämpfen.
dlga_lord_talk:lord_ask_leave_service|{s66}, ich möchte von meinem Treueschwur auf Euch entbunden werden.
dlga_lord_talk:lord_talk_preoffer|Ich habe ein Angebot für Euch.
dlga_lord_talk:lord_give_troops|Ich möchte Euch einige Truppen überstellen.
dlga_lord_give_troops:lord_pretalk|Nun, ich könnte einige gute Soldaten gut gebrauchen. Ich danke Euch.
dlga_lord_talk:lord_give_order_ask|Ich habe eine neue Aufgabe für Euch.
dlga_lord_give_order_ask:lord_give_order|Ja?
dlga_lord_give_order:lord_give_order_answer|Folgt mir.
dlga_lord_give_order:lord_give_order_details_ask|Begebt Euch zu ...
dlga_lord_give_order:lord_give_order_details_ask.1|Überfallt die Umgebung des Dorfes ...
dlga_lord_give_order:lord_give_order_details_ask.2|Patrouilliert um ...
dlga_lord_give_order:lord_give_order_stop|Ich werde Eure Dienste einige Zeit nicht benötigen. Ihr seid frei, Euren eigenen Dingen nachzugehen.
dlga_lord_give_order:lord_pretalk|Schon gut.
dlga_lord_give_order_details_ask:lord_give_order_details|Wo?
dlga_lord_give_order_details:lord_give_order_answer|{s1}
dlga_lord_give_order_details:lord_pretalk|Schon gut.
dlga_lord_give_order_stop:lord_pretalk|In Ordnung. Ich werde dem Folge leisten.
dlga_lord_give_order_answer:lord_pretalk|Es tut mir Leid. Ich muss mich momentan eigenen Belangen widmen.
dlga_lord_give_order_answer:lord_give_order_answer_2|.
dlga_lord_give_order_answer_2:close_window|Ich werde dem Folge leisten.
dlga_lord_give_order_answer_2:lord_pretalk|Es tut mir Leid, aber dies steht nicht in meiner Macht.
dlga_lord_talk:lord_give_order_call_to_arms_verify|Ich möchte einen neuen Feldzug beginnen. Lasst uns die Armee hier zusammenführen.
dlga_lord_give_order_call_to_arms_verify:lord_give_order_call_to_arms_verify_2|Möchtet Ihr sämtliche Fürsten für einen neuen Feldzug zusammenrufen?
dlga_lord_give_order_call_to_arms_verify_2:lord_give_order_call_to_arms|Jawohl. Bevor wir gegen den Feind marschieren, müssen wir all unsere Truppe sammeln.
dlga_lord_give_order_call_to_arms_verify_2:lord_pretalk|Bei näherem Nachdenken ist es wohl doch nicht erforderlich, alle herbei zu rufen.
dlga_lord_give_order_call_to_arms:lord_pretalk|Nun gut. Ich werden Boten entsenden, und allen mitteilen lassen, sich hier einzufinden.
dlga_lord_talk:lord_give_order_disband_army_verify|Ich möchte den Feldzug beenden und alle nach Hause zurückkehren lassen.
dlga_lord_give_order_disband_army_verify:lord_give_order_disband_army_2|Ihr möchtet den aktuellen Feldzug beenden und alle Fürsten Ihrer Pflichten entbinden?
dlga_lord_give_order_disband_army_2:lord_give_order_disband_army|Jawohl. Wir benötigen hier nicht länger sämtliche Truppen.
dlga_lord_give_order_disband_army_2:lord_pretalk|Bei näherem Nachdenken wäre es wohl besser, vorerst zusammen zu bleiben.
dlga_lord_give_order_disband_army:lord_pretalk|In Ordnung. Ich werde allen mitteilen, dass sie Ihrer Pflichten entbunden sind.
dlga_lord_talk:lord_talk_ask_something|Ich möchte Euch etwas fragen.
dlga_lord_talk_ask_something:lord_talk_ask_something_2|Hmmm? Was gibt es denn?
dlga_lord_talk_ask_something_2:lord_talk_ask_location|Ich möchte den Aufenthaltsort einer Person wissen.
dlga_lord_talk_ask_something_2:lord_tell_objective|Mit welcher Unternehmung seid Ihr und Eure Männer beschäftigt?
dlga_lord_talk_ask_something_2:lord_talk_ask_about_war|Wie läuft der Krieg?
dlga_lord_talk_ask_something_2:lord_pretalk|Schon gut.
dlga_lord_talk_ask_location:lord_talk_ask_location_2|Nun gut, ich könnte eine Antwort für Euch haben ... oder auch nicht. Über wen möchtet Ihr Bescheid wissen?
dlga_lord_talk_ask_location_2:lord_talk_ask_location_3|{s1}
dlga_lord_talk_ask_location_2:lord_pretalk|Schon gut.
dlga_lord_talk_ask_location_3:lord_pretalk|{s1}
dlga_lord_talk_ask_about_war:lord_talk_ask_about_war_2|{s12}
dlga_lord_talk_ask_about_war_2:lord_talk_ask_about_war_details|Erzählt mir mehr über den Krieg mit {s1}.
dlga_lord_talk_ask_about_war_2:lord_pretalk|Mehr wollte ich nicht wissen. Ich danke Euch.
dlga_lord_talk_ask_about_war_details:lord_talk_ask_about_war_2|Wir haben {reg5?{reg5}:keine} {reg3?Armeen:Armee} und sie haben {reg6?{reg6}:keine}. Insgesamt, {s9}.
dlga_lord_talk:party_encounter_lord_hostile_ultimatum_surrender|{s4}, ich werde dies nur einmal sagen! Ergebt Euch oder sterbt!
dlga_party_encounter_lord_hostile_ultimatum_surrender:close_window|{s43}
dlga_lord_talk:lord_predemand|Ich bin hier, um Euch meine Bedingungen zu unterbreiten!
dlga_lord_predemand:lord_demand|Was? Was wollt Ihr?
dlga_lord_demand:lord_ultimatum_surrender|Ich gebe Euch die Gelegenheit, Euch zu ergeben. Ansonsten müsst Ihr sterben.
dlga_lord_ultimatum_surrender:lord_attack_verify|{s43}
dlga_lord_attack_verify:lord_attack_verify_cancel|Vergebt mir, Herr. Ich weiß nicht, was mir in den Sinn gekommen ist.
dlga_lord_attack_verify_cancel:close_window|Dann packt Euch.
dlga_lord_attack_verify:lord_attack_verify_commit|Das geht Euch nichts an. Bereitet Euch auf den Kampf vor!
dlga_lord_ultimatum_surrender:lord_attack_verify_b|{s43}
dlga_lord_attack_verify_b:lord_attack_verify_cancel|Vergebt mir, Herr. Ich weiß nicht, was mir in den Sinn gekommen ist.
dlga_lord_attack_verify_b:lord_attack_verify_commit|Ich weiche nicht von der Stelle. Bereitet Euch auf den Kampf vor!
dlga_lord_attack_verify_commit:close_window|{s43}
dlga_lord_demand:lord_pretalk|Vergebt mir. Nichts.
dlga_lord_talk:liege_defends_claim_1|Ich traf auf meinen Reisen eine Person namens ...
dlga_liege_defends_claim_1:liege_defends_claim_2|Tatsächlich? Nicht jedermann wagt, diesen Namen in meiner Gegenwart auszusprechen. Ich weiß nicht, ob Ich Euren Mut belohnen oder Eure Unverfrorenheit bestrafen soll.
dlga_liege_defends_claim_2:liege_defends_claim_3|Nun gut. Ich werde Eurer Neugier nachgeben. Aber hört gut zu, denn ich wünsche nicht, noch einmal über diese Angelegenheit zu sprechen.
dlga_liege_defends_claim_3:liege_defends_claim_4|{s48}
dlga_liege_defends_claim_4:lord_talk|{s48}
dlga_lord_talk:lord_join_rebellion_suggest|{s12} ist der rechtmäßige Herrscher {s14}. Tretet unserem Kampf gegen den Thronräuber {s15} bei!
dlga_lord_talk:lord_join_rebellion_suggest_cheat|CHEAT: Join our cause by force.
dlga_party_encounter_lord_hostile_attacker_2:lord_join_rebellion_suggest_cheat|CHEAT: Join our cause by force.
dlga_lord_join_rebellion_suggest_cheat:lord_join_rebellion_ask_for_order|Cheat:Allright.
dlga_party_encounter_lord_hostile_attacker_2:lord_join_rebellion_suggest|{s12} ist Euer rechtmäßiger Herrscher. Tretet unserem Kampf gegen den Thronräuber {s15} bei!
dlga_lord_join_rebellion_suggest:party_encounter_lord_hostile_attacker_2|Ich habe keine Zeit, Worte mit Leuten Eures Schlages zu wechseln. Nun greift zum Schwert und verteidigt Euch!
dlga_lord_join_rebellion_suggest:lord_start|Ich habe keine Zeit, Worte mit Leuten Eures Schlages zu wechseln.
dlga_lord_join_rebellion_suggest:party_encounter_lord_hostile_attacker_2.1|{s43}
dlga_lord_join_rebellion_suggest:lord_start.1|{s43}
dlga_lord_join_rebellion_suggest:lord_join_rebellion_suggest_1b|{s43}
dlga_lord_join_rebellion_suggest_1b:lord_join_rebellion_suggest_2|{s43}
dlga_lord_join_rebellion_suggest_2:lord_join_rebellion_suggest_2|{s47}
dlga_lord_join_rebellion_suggest_2:lord_join_rebellion_suggest_2.1|{s43}
dlga_lord_join_rebellion_suggest_2:lord_join_rebellion_suggest_3|Also sagt es mir. Wenn sollte ich unterschützen, {s45}?
dlga_lord_join_rebellion_suggest_3:lord_join_rebellion_suggest_4|Rechtmäßigkeit -- {s45} hat den besseren Thronanspruch.
dlga_lord_join_rebellion_suggest_3:lord_join_rebellion_suggest_4.1|Gerechtigkeit -- {s45} wird {reg39?ihre:seine} Untertanen besser als {s46} behandeln.
dlga_lord_join_rebellion_suggest_3:lord_join_rebellion_suggest_4.2|Zweckmäßigkeit -- {s45} wird gewinnen, und je schneller {reg39?sie:er} siegt, desto eher wird dieser Krieg enden.
dlga_lord_join_rebellion_suggest_3:lord_join_rebellion_suggest_4.3|Eigennutz -- {s45} wird {reg39?ihre:seine} Anhänger gut belohnen.
dlga_lord_join_rebellion_suggest_3:lord_join_rebellion_suggest_4.4|Keiner der üblichen Gründe. Meine Denkweise ist etwas anders.
dlga_lord_join_rebellion_suggest_3:lord_join_rebellion_suggest_4.5|Es gibt mehr als einen Grund. Ich werde Euch selbst entscheiden lassen.
dlga_lord_join_rebellion_suggest_3:lord_join_rebellion_suggest_5|Wenn Ihr so denkt, solltet Ihr erwägen, {s46} gegenüber loyal zu bleiben.
dlga_lord_join_rebellion_suggest_4:lord_join_rebellion_suggest_4|Hmmm. Könnte es sein, dass Ihr jedem Fürsten etwas anderes erzählt, um sich bei ihm einzuschmeicheln?
dlga_lord_join_rebellion_suggest_4:lord_join_rebellion_suggest_5|Nun gut. {s51}{s52}{s53}{s54}{s55}
dlga_lord_join_rebellion_suggest_5:lord_join_rebellion_ask_for_order|{s43}
dlga_lord_join_rebellion_suggest_5:party_encounter_lord_hostile_attacker_2|{s43}
dlga_lord_join_rebellion_suggest_5:lord_talk|{s43}
dlga_lord_join_rebellion_ask_for_order:lord_give_order|In Ordnung. Also, wie lautet Euer Plan? Wie lauten Eure Pläne für mich?
dlga_lord_talk:lord_suggest_action_ask|CHEAT:Ich möchte to suggest a course of action.
dlga_lord_tell_objective:lord_pretalk|Was ich hier mache? Nach was sieht es denn aus, was ich hier mache! Ich bin hier gefangen!
dlga_lord_tell_objective:lord_pretalk.1|Momentan habe ich keine Soldaten unter meinem Kommando.
dlga_lord_tell_objective:lord_pretalk.2|Wir halten Rast bei {s1}.
dlga_lord_tell_objective:lord_pretalk.3|Wir reisen nach {s1}.
dlga_lord_tell_objective:lord_pretalk.4|Wir rekrutieren neue Soldaten aus {s1}.
dlga_lord_tell_objective:lord_pretalk.5|Wir halt im Gebiet um {s1} nach Feinden Ausschau.
dlga_lord_tell_objective:lord_pretalk.6|Wir legen das Dorf {s1} in Schutt und Asche.
dlga_lord_tell_objective:lord_pretalk.7|Wir ziehen uns nach {s1} zurück.
dlga_lord_tell_objective:lord_pretalk.8|Wir belagern {s1}.
dlga_lord_tell_objective:lord_pretalk.9|Wir kämpfen gegen {s1}.
dlga_lord_tell_objective:lord_pretalk.10|Wir begleiten {s1}.
dlga_lord_tell_objective:lord_pretalk.11|Wir überdenken unser nächstes Missionsziel.
dlga_lord_tell_objective:lord_pretalk.12|Ich weiß nicht: {reg1} {s1}
dlga_lord_talk:lord_ask_follow|Werdet Ihr mir folgen? Ich habe einen Plan.
dlga_lord_ask_follow:close_window|Ich genieße Eure Gesellschaft, {playername}, doch es gibt andere Dinge, um die ich mich kümmern muss. In einigen Tagen könnte ich mich Euch eventuell wieder anschließen.
dlga_lord_ask_follow:close_window.1|Das wäre wohl kaum angemessen, {playername}. Warum folgt Ihr nicht stattdessen mir?
dlga_lord_ask_follow:close_window.2|{s43}
dlga_lord_ask_follow:close_window.3|Reiter voran, {playername}! Lasst uns allen Feinden Tod und Verderben bringen.
dlga_lord_talk_preoffer:lord_talk_offer|Ja?
dlga_lord_talk_offer:knight_offer_join|Ich möchte einen Eurer Gefangenen auslösen.
dlga_lord_talk_offer:lord_pretalk|Schon gut.
dlga_knight_offer_join:hero_pretalk|Ich fürchte, {playername}, dass ich mich Euch jetzt nicht anschließen kann, denn ich muss mich um dringliche Angelegenheiten kümmern, die nicht aufgeschoben werden können.
dlga_knight_offer_join:hero_pretalk.1|Ihr vergesst Euren Rang, {mein Herr/meine Dame}. Von Euresgleichen nehme ich keine Befehle an.
dlga_knight_offer_join:knight_offer_join_2|Ich würde gerne an Eurer Seite kämpfen, mein Freund, doch es gibt da ein Problem ... ich stehe bei jemandem in der Schuld, die bald getilgt werden muss, und ich habe mein Ehrenwort gegeben, jede Münzen zurück zu zahlen. Falls Ihr nicht gerade {reg6} entbehren könnt, fürchte ich, dass ich meine Konzentration auf die Tilgung dieser Schuld richten muss.
dlga_knight_offer_join:close_window|Mich Euch anschließen? Das könnte Euch so passen ...
dlga_knight_offer_join:knight_offer_join_2.1|Gut, mein Freund, ich werde mich Euch gerne anschließen.
dlga_knight_offer_join_2:knight_offer_join_accept|Hier, nehmt so viele {reg6} Dinare wie Ihr benötigt. Ist ja nur Geld.
dlga_knight_offer_join_2:knight_offer_join_accept.1|Dann lasst uns zusammen weiter ziehen, mein Freund.
dlga_knight_offer_join_2:close_window|Das ist gut zu wissen. Ich werde darüber nachdenken.
dlga_knight_offer_join_2:hero_pretalk|Das ist gut zu wissen. Ich werde darüber nachdenken.
dlga_knight_offer_join_accept:knight_offer_join_accept_party|Ich habe erfahrene Männer in meiner Begleitung, die für Euch von Nutzen sein könnten. Welche Aufgaben habt Ihr für sie im Sinn?
dlga_knight_offer_join_accept:close_window|Ah, sicherlich, das könnte ein Spaß werden!
dlga_knight_offer_join_accept_party:knight_join_party_disband|Ihr könnt Eure Truppen auflösen. Ich habe für Eure Soldaten keine Verwendung.
dlga_knight_offer_join_accept_party:knight_join_party_join|Eure Männer können sich uns anschließen. Wir brauchen jeden kampffähigen Soldaten.
dlga_knight_offer_join_accept_party:knight_join_party_lead_out|Führt Eure Soldaten aus der Stadt. Ich werde unterwegs zu Euch aufschließen.
dlga_knight_offer_join_accept_party:knight_join_party_lead_out.1|Fahrt damit fort, womit Ihr gerade beschäftigt seid. Ich werde später zu Euch aufschließen.
dlga_knight_join_party_disband:close_window|Ah . . . Sehr gut, {playername}. Ich hasse es zwar, gute Soldaten zu verlieren, doch die Entscheidung liegt bei Euch. Ich werde meine Truppen auflösen und mich Euch anschließen.
dlga_knight_join_party_join:close_window|Ausgezeichnet. Meine Kameraden und ich werden uns Euch anschließen.
dlga_knight_join_party_lead_out:close_window|Nun gut, abgemacht. Ich werde dieses Gebiet patrouillieren lassen. Sucht mich wieder auf, wenn Ihr weitere Befehle für mich habt.
dlga_lord_enter_service_reject:close_window|Was für ein Saufraß! Und ich wollte Euch einen Platz unter meinen Nobelmännern anbieten. Packt Euch hinfort, Ihr Bettler, bevor ich meine Beherrschung verliere!
dlga_lord_ask_enter_service:lord_give_oath_under_oath_already|Steht Ihr nicht bereits in Diensten von {s5}?
dlga_lord_give_oath_under_oath_already:lord_pretalk|Fürwahr, das trifft zu, {s65}. Verzeiht meine Ausschweifungen.
dlga_lord_ask_enter_service:lord_pretalk|Ich kann Treueschwüre nur von jenen akzeptieren, {playername}, die meines Erachtens nach auch zu ihrem Wort stehen.
dlga_lord_ask_enter_service:lord_give_oath_1|{playername}, Ihr seid als tapferer {Ritter/Krieger} und guter Anführer bekannt. Mit Freude werde ich Euer Schwert in meine Dienste aufnehmen und Euch in den Rang eines Vasalls erheben, wenn Ihr mir die Treue schwört.
dlga_lord_ask_enter_service:lord_pretalk.1|Noch habt Ihr Euch nicht als kompetenter Befehlshaber unter Beweis gestellt, {playername}. Bekämpft meine Feinde, und zeigt mir, dass Ihr würdigt seid, mein Vasall zu werden. Danach werden wir uns genauer über diese Angelegenheit unterhalten.
dlga_lord_give_oath_1:lord_give_oath_2|Ich bin bereit, {s65}.
dlga_lord_give_oath_1:lord_give_oath_give_up|Vergebt mir, {s65}, ich muss diese Angelegenheit zuerst genauer überdenken ...
dlga_lord_give_oath_give_up:close_window|Was plant Ihr, {playername}? Geht und denkt nach - und verschwendet meine Zeit nicht länger.
dlga_lord_give_oath_2:lord_give_oath_3|Gut. Dann wiederholt meine Worte: Ich schwöre Euch als rechtmäßigem Herrscher von {s41} die Treue.
dlga_lord_give_oath_3:lord_give_oath_4|Ich schwöre Euch als rechtmäßigem Herrscher von {s41} die Treue.
dlga_lord_give_oath_3:lord_give_oath_give_up|Entschuldigt, {reg65?Herrin:Herr}: Mich deucht, dass ich noch ein wenig hierüber nachdenken muss.
dlga_lord_give_oath_4:lord_give_oath_5|Ich werde Euer loyaler und ergebener {Soldat/Anhänger} sein, so lange ich auf dieser Erde weile ...
dlga_lord_give_oath_5:lord_give_oath_6|Ich werde Euer loyaler und ergebener {Soldat/Anhänger} sein, so lange ich auf dieser Erde weile ...
dlga_lord_give_oath_5:lord_give_oath_give_up|{reg65?Meine Herrin:Mein Herr}, dürfte ich noch um etwas Bedenkzeit hierüber bitten?
dlga_lord_give_oath_6:lord_give_oath_7|... und ich werde an Eurer Seite gegen Eure Feinde zu Felde ziehen, solltet Ihr mein Schwert benötigen.
dlga_lord_give_oath_7:lord_give_oath_8|... und ich werde an Eurer Seite gegen Eure Feinde zu Felde ziehen, solltet Ihr mein Schwert benötigen.
dlga_lord_give_oath_7:lord_give_oath_give_up|{reg65?Meine Herrin:Mein Herr}, bitte gebt mir mehr Zeit, um hierüber nachzudenken.
