dlga_farmer_from_bandit_village_5:farmer_from_bandit_village_barter|Warum sollte ich gegen diese Banditen kämpfen? Was ist für mich drin?
dlga_farmer_from_bandit_village_accepted:close_window|Gott schütze Euch, {mein Herr/meine Dame}. Unser Dorf ist {s7}. Er ist nicht allzu weit von hier entfernt.
dlga_farmer_from_bandit_village_denied:close_window|Wie Ihr meint, {mein Herr/meine Dame}. Vergebt mir, Euch belästigt zu haben.
dlga_farmer_from_bandit_village_barter:farmer_from_bandit_village_5|Wir sind nur arme Bauern, {mein Herr/meine Dame}, und die Banditen haben bereits fast alles gestohlen, was wir hatten, aber wir werden gerne das wenige mit Euch teilen, das uns geblieben ist. Und wir werden für immer in Eurer Schuld stehen, solltet Ihr uns helfen.
dlga_start:close_window.18|Danke für Eure Hilfe, {mein Herr/meine Dame}. Vernichtet diese Banditen!
dlga_start:mercenary_tavern_talk|Habt Ihr Bedarf an Landsknechten, {mein Herr/meine Dame}? {reg3?Ich und {reg4?{reg3} meiner Kameraden:einer meiner Kameraden} sind:sind} auf der Suche nach einem neuen Dienstherrn. Für {reg5} Dinare werden wir uns Euch anschließen.
dlga_start:mercenary_after_recruited|Wie lauten Eure Befehle, {mein Herr/meine Dame}?
dlga_mercenary_after_recruited:mercenary_after_recruited_2|Trefft Eure Vorbereitungen. Wir rücken im Morgengrauen ab.
dlga_mercenary_after_recruited:mercenary_after_recruited_2.1|Lasst Euch Zeit. Wir werden noch eine Weile in dieser Stadt bleiben.
dlga_mercenary_after_recruited_2:close_window|Ja, {mein Herr/meine Dame}. Wir werden jederzeit aufbruchbereit sein.
dlga_mercenary_tavern_talk:mercenary_tavern_talk_hire|In Ordnung. Ich werde alle von Euch in Sold nehmen. Hier sind {reg5} Dinare.
dlga_mercenary_tavern_talk:mercenary_tavern_talk_hire.1|In Ordnung. Aber ich kann nur {reg6} von Euch in Sold nehmen. Hier sind {reg5} Dinare.
dlga_mercenary_tavern_talk_hire:close_window|{s17}
dlga_mercenary_tavern_talk:tavern_mercenary_cant_lead|Das klingt gut. Aber ich kann momentan kein weiteren Männer mehr anwerben.
dlga_tavern_mercenary_cant_lead:close_window|Eine wahre Schande. Wohlan, wenn Ihr noch jemanden für Euren Trupp sucht, werdet Ihr {reg3?mich:uns} noch eine Weile lang hier finden.
dlga_mercenary_tavern_talk:tavern_mercenary_cant_lead.1|Das klingt gut. Aber momentan kann ich keine weiteren Männer mehr anführen.
dlga_mercenary_tavern_talk:close_window|Vergebt mir. Ich benötige momentan keine weiteren Männer.
dlga_start:trainer_intro_1|Guten Tag, {Junge/Mädchen}. Ihr seht wie einer der Abenteurer aus, die in diesen Landen hier ihr Glück versuchen. Nun, Ihr könnt meinen Worten Glauben schenken, wenn ich Euch sage, dass Ihr hier nicht lange überleben werdet, sofern Ihr Euch nicht aus einer Zwickmühle herauskämpfen könnt.
dlga_trainer_intro_1:trainer_intro_2|Danke für Euren Rat. Dieser Ort sieht wie ein Übungsplatz aus. Vielleicht kann ich hier die Kampfeskunst erlernen?
dlga_trainer_intro_2:trainer_intro_3|Fürwahr, das könnt Ihr. Ich bin ein Kriegsveteran ... in meinem Leben habe ich gar viele Kämpfe gefochten. Doch diese Tage sind vorbei, und nun bilde ich junge Kämpfer dieser Region aus. Wenn Ihr es wünscht, kann ich Euch einige Übungspartner suchen. Doch auch wenn Ihr Fragen über die Theorie des Kampfes habt, seid Ihr willkommen. Fragt nur zu!
dlga_trainer_intro_3:trainer_intro_4a|Ja, ich habe tatsächlich einige Fragen.
dlga_trainer_intro_3:trainer_intro_4b|Ich kann wohl direkt mit den Übungen beginnen.
dlga_trainer_intro_4a:trainer_talk_combat|Wohlan, fragt alles, war Ihr wollt.
dlga_trainer_intro_4b:trainer_practice_1|Fein. Es ist eine gute Sache, Leute mit Übungseifer zu treffen. Lasst mal sehen, wie Ihr Euch anstellt.
dlga_start:trainer_practice_1|Das war ein guter Kampf.
dlga_start:trainer_practice_1.1|Ha! Kaum haben wir angefangen, fangt Ihr schon zu humpeln an ... Keine Sorge, auch Niederlagen haben ihren Wert, sofern Ihr aus ihnen eine Lehre zieht. Reißt Euch zusammen und kommt wieder hier herein. Das ist der einzige Weg zum Sieg.
dlga_start:trainer_talk|Guten Tag. Bereit für einige Lektionen?
dlga_trainer_pretalk:trainer_talk|Ah, seid Ihr bereit für weitere Lektionen?
dlga_trainer_talk:trainer_practice_1|Jawohl, ich bin bereit.
dlga_trainer_talk:trainer_combat_begin|Lasst mich Euch zunächst etwas über den Kampf erzählen ...
dlga_trainer_talk:close_window|Ich muss Euch jetzt verlassen. Lebt wohl.
dlga_trainer_combat_begin:trainer_talk_combat|Was möchtet Ihr als nächstes wissen?
dlga_trainer_combat_pretalk:trainer_talk_combat|Was wollt Ihr sonst noch wissen?
dlga_trainer_talk_combat:trainer_explain_defense|Erzählt mir über Selbstverteidigung.
dlga_trainer_talk_combat:trainer_explain_attack|Erzählt mir über das Angreifen mit Waffen.
dlga_trainer_talk_combat:trainer_explain_horseback|Erzählt mir über den Kampf zu Pferde.
dlga_trainer_talk_combat:trainer_pretalk|Ich kenne ich mich mit der Theorie wohl gut genug aus. Lasst uns über etwas anderes reden.
dlga_trainer_explain_defense:trainer_explain_defense_2|Gute Frage. Zuallererst muss ein Kämpfer wissen, wir er sich verteidigen kann. Sich selbst zu schützen ist die oberste Regel im Kampfe, sogar noch wichtiger, als anderen zu schaden. Jeder kann ein Schwert herum schwingen, und auf einen Glückstreffer hoffen, doch nur Experten in der Verteidigung leben lange genug, um von ihren Taten zu erzählen.
dlga_trainer_explain_defense_2:trainer_explain_defense_3|Also, mit einem Schild ist die Verteidigung am einfachsten. Blockiert den Angreifer einfach mit Eurem Schild. [Haltet die rechte Maustaste gedrückt, um Euch mit dem Schild zu verteidigen]. So könnt Ihr alle Angriffe von vorne abwehren. Gegen Schläge von der Seite oder von hinten seid Ihr jedoch immer noch verwundbar.
dlga_trainer_explain_defense_3:trainer_explain_defense_4|Was ist, wenn ich keinen Schild habe?
dlga_trainer_explain_defense_4:trainer_combat_pretalk|Dann werdet Ihr Euren Gegner mit Eurer Waffe abwehren müssen. Dies ist etwas schwieriger als die Verteidigung mit einem Schild. Wenn Ihr Euch mit einer Waffe verteidigt, könnt Ihr Euch nur gegen Angriffe aus EINER Richtung wehren, und zwar gegen Überkopfschläge, Seitwärtsschläge und Stöße. Dazu müsst Ihr Euren Gegner genau beobachten, und Eure Abwehraktion starten, NACHDEM er zum Schlag ausgeholt hat. Auf diese Weise könnt Ihr seinen Angriff abwehren. Wenn Ihr Eure Abwehrbewegung dagegen beginnt, BEVOR er Euch angreift, so könnte er Euch aus einer anderen Richtung attackieren und einen Treffer landen.
dlga_trainer_explain_attack:trainer_explain_attack_2|Gute Frage. Man sagt, dass Angriff die beste Verteidigung ist. Viele Kämpfer nehmen eine offensive  Haltung ein und bereiten Ihre Waffen auf den Angriff vor, auf den richtigen Augenblick zum Zuschlagen wartend [Ihr könnt Eure Waffe schlagbereit machen, indem Ihr die linke Maustaste gedrückt haltet].
dlga_trainer_explain_attack_2:trainer_explain_attack_3|Das klingt hilfreich.
dlga_trainer_explain_attack_3:trainer_explain_attack_4|Es ist wahrlich eine gute Taktik, doch vergesst nicht, dass Euer Feind sehen kann, was Ihr vorhabt, und dann wahrscheinlich in die Richtung Eures Schlages eines Abwehrhaltung einnimmt. Wenn das passiert, so müsst Ihr Euren Angriff abbrechen und schnell aus einer anderen Richtung angreifen [Ihr könnt Angriffe durch schnelles Drücken auf die rechte Maustaste abbrechen.
dlga_trainer_explain_attack_4:trainer_explain_attack_5|Wenn sich der Gegner gegen meine Angriffsrichtung verteidigt, so werde ich einen Ausfall machen und ihn aus einer anderen Richtung attackieren].
dlga_trainer_explain_attack_5:trainer_combat_pretalk|Jawohl, die Auswahl der Schlagrichtung Eurer Waffe ist eine wichtige Fertigkeit. Ihr könnt nach rechts, nach links oder Überkopf schlagen und mit der Waffe nach vorne stoßen. Jeden Schlag müsst Ihr bedacht einsetzen [Bewegt Eure Maus zur Auswahl der Schlagrichtung in die Richtung, in die Ihr schlagen wollt, während Ihr die linke Maustaste drückt].
dlga_trainer_explain_horseback:trainer_combat_pretalk|Eine sehr gute Frage. Ein Pferd kann im Kampfe die stärkste Waffe eines Kriegers sein. Es verleiht Euch Geschwindigkeit, Höhenvorteile, Kraft und Initiative. Viele tödliche Waffen werden auf einem Pferderücken noch gefährlicher. Ihr müsst jedoch auch auf berittene Feinde achten und ihren Lanzen ausweichen, die jeden Gegner mit einem Treffer niederstrecken können [Zum Anlegen einer Lanze oder einer ähnlichen Waffe müsst Ihr Euer Pferd zum Galopp bringen, worauf die Lanze bei einer bestimmten Geschwindigkeit von selbst angelegt wird. Drückt dazu jedoch keine Angriffs- oder Verteidigungstasten. Legt dann durch Manövrierung Eures Pferdes auf Eure Feinde an].
dlga_trainer_practice_1:trainer_practice_1|Anfänger bilde ich in vier Stufen aus, wobei die nächste immer schwerer als die vorherige ist. Zum Abschluss einer Stufe und zum Beginn der nächsten müsst Ihr hintereinander in drei Kämpfen bestehen.
dlga_trainer_practice_1:novicemaster_are_you_ready|Ihr habt alle Ausbildungsstufen absolviert. Doch wenn Ihr wollt, könnt Ihr trotzdem noch üben. Seid Ihr bereit?
dlga_trainer_practice_1:trainer_practice_1.1|Gut gemacht, {Junge/Mädchen}. Mit diesem Sieg habt Ihr es zur nächsten Ausbildungsstufe geschafft. Ab jetzt werden Eure Gegner richtige Kämpfer sein und nicht dieses Gesocks von der Straße. Seid also auf der Hut!
dlga_trainer_practice_1:trainer_practice_1.2|Gut gemacht, {Junge/Mädchen}. Willkommen zur dritten Ausbildungsstufe. Ab jetzt werden sich Euch erfahrene Kämpfer entgegen stellen.
dlga_trainer_practice_1:trainer_practice_1.3|Ihr habt das Herz eines Siegers, {Kamerad/Kameradin}, und den passenden Schwertarm dazu. Von nun an werden Euch Meisterkämpfer entgegentreten. Dies sind die Besten der Besten – die begabtesten Krieger, die ich je ausgebildet habe. Wenn Ihr alle drei von ihnen hintereinander besiegen könnt, schließt Ihr im Rang zu ihnen auf.
dlga_trainer_practice_1:novicemaster_finish_training|Es wärmt mein Herz, jemand mit solchem Talent kämpfen zu sehen. Ihr habt sämtliche Ausbildungsstufen absolviert. Fürderhin könnt Ihr jedermann sagen, dass Euch der Übungsplatzmeister ausgebildet hat.
dlga_novicemaster_finish_training:novicemaster_finish_training_2|Ich danke Euch, Meister.
dlga_novicemaster_finish_training_2:close_window|Ich wünsche Euch viel Glück bei den Turnieren. Und vergesst nicht: Wenn Ihr wieder einmal nach etwas Übung mit dem Schwerte bedürft, seid Ihr hier stets willkommen.
dlga_trainer_practice_1:novicemaster_are_you_ready.1|Euer nächster Gegner wird ein {s9} sein. Ihr müsst zum Erreichen der nächsten Stufe noch {reg8} weitere Kämpfe hintereinander gewinnen. Seid Ihr bereit?
dlga_novicemaster_are_you_ready:novicemaster_ready_to_fight|Jawohl, das bin ich.
dlga_novicemaster_ready_to_fight:close_window|Also los geht's. Viel Glück.
dlga_novicemaster_are_you_ready:novicemaster_not_ready|Einen Moment. Ich bin noch nicht bereit.
dlga_novicemaster_not_ready:close_window|He, wenn Ihr nicht übt, werdet Ihr es niemals schaffen.
dlga_start:mayor_begin|Guten Tag, mein Fürst.
dlga_start:mayor_talk|Hallo Fremder, Ihr scheint neu in {s9} zu sein. Ich bin der Gildenmeister der Stadt.
dlga_start:mayor_begin.1|Guten Tag, {playername}.
dlga_mayor_begin:lord_persuade_lords_to_make_peace_completed|{playername}, es war eine unglaubliche Heldentat, {s14} und {s15} zur Friedensschließung zu bewegen. Euer Handeln hat nicht nur unsere Stadt vor einer Katastrophe bewahrt, sondern auch Tausende Leben gerettet und dem ganzen Kummer, den dieser grausame Krieg verursacht, ein Ende bereitet. Das Stadtvolk von {s19} steht zu seinem Wort, und wir sind bereit, Euch wie versprochen {reg12} Dinare zu zahlen.
dlga_lord_persuade_lords_to_make_peace_completed:lord_persuade_lords_to_make_peace_pay|Ich danke Euch. Gebt mir das Geld.
dlga_lord_persuade_lords_to_make_peace_completed:lord_persuade_lords_to_make_peace_no_pay|Eine Bezahlung ist nicht notwendig. Ich habe nur getan, was recht war.
dlga_lord_persuade_lords_to_make_peace_pay:close_window|Oh, ja, natürlich. Wir haben das Geld für Euch bereits beschafft. Hier, bitte akzeptiert diese {reg12} Dinare zusammen mit unseren aufrichtigen Dank. Ich und das Volk unserer Stadt wird Eure Hilfe nicht vergessen.
dlga_lord_persuade_lords_to_make_peace_no_pay:close_window|Ihr seid wahrlich eine außergewöhnliche Person, {mein Herr/meine Dame}, und es ist eine Ehre für mich, Euch gekannt zu haben. Ihr habt mit der Beendigung dieses Krieges nicht nur Unmögliches geleistet, sonst sogar Eure Belohnung dafür ausgeschlagen! Wohlan, ich werde nicht darauf bestehen, doch bitte seid Euch bewusst, dass Ihr unseren ewigen Dank und Respekt habt.
dlga_mayor_begin:lord_deal_with_night_bandits_completed|Sehr gute Arbeit, {playername}, aus diesem gesetzlosen Lumpenpack habt Ihr kurzen Prozess gemacht. Vielen Dank für all Eure Hilfe, und bitte akzeptiert dieses Kopfgeld von 150 Dinaren.
dlga_lord_deal_with_night_bandits_completed:close_window|Es war mir eine Ehre, {s65}.
dlga_mayor_begin:mayor_looters_quest_response|Ah, {playername}. Habt Ihr schon Fortschritte zu vermelden?
dlga_mayor_looters_quest_response:mayor_looters_quest_destroyed|Ich habe einige Plünderer getötet.
dlga_mayor_looters_quest_response:mayor_looters_quest_goods|Ich habe Euch einige Waren gebracht.
dlga_mayor_looters_quest_response:close_window|Noch nicht, Herr. Lebt wohl.
dlga_mayor_looters_quest_destroyed:mayor_looters_quest_destroyed_2|Ja, meine Späher haben alles gesehen. Das sollte anderen zu denken geben, ob sie tatsächlich den Weg der Halunken einschlagen wollen! Das Kopfgeld ist 40 Dinare für jede Bande, also insgesamt {reg1}. Hier ist Euer Geld, wie versprochen.
dlga_mayor_looters_quest_destroyed_2:close_window|Und das sind nicht die einzigen guten Neuigkeiten! Dank Euch stellen die Plünderer nun kein Problem mehr da. Sie haben uns schon einige Zeit lang nicht mehr angegriffen. Sollten noch welche von ihnen übrig sein, so sind sie entweder geflüchtet oder halten sich versteckt. Das ist gut fürs Geschäft, und was gut fürs Geschäft ist, ist gut für die Stadt! {playername}, damit ist unsere Vereinbarung wohl zu Ende. Bitte akzeptiert diese Summe als Zeiche meiner Dankbarkeit. Ich danke Euch, und lebt wohl!
dlga_mayor_looters_quest_destroyed_2:mayor_looters_quest_response|Braucht Ihr sonst noch etwas?
dlga_mayor_looters_quest_goods:mayor_looters_quest_goods_response|Ha, ich wusste, dass ich mich auf Euch verlassen kann! Sagt mir einfach, welchen Gegenstand Eures Gepäcks Ihr haben wollt, und ich werde einige Männer losschicken, um ihn zu holen. Ich brauche immer noch Waren im Wert von {reg1} Dinaren.
dlga_mayor_looters_quest_goods_response:mayor_looters_quest_goods_2|{s5}.
dlga_mayor_looters_quest_goods_response:mayor_looters_quest_goods_3|Momentan nichts, Herr.
dlga_mayor_looters_quest_goods_3:mayor_looters_quest_response|Braucht Ihr sonst noch etwas?
dlga_mayor_looters_quest_goods_2:mayor_looters_quest_goods_response|Hervorragend, hier ist das Geld für Eure {s6}. Habt Ihr noch weitere Waren für mich? Ich brauche immer noch Waren im Wert von {reg1} Dinaren.
dlga_mayor_looters_quest_goods_2:close_window|Gut gemacht, {playername}, jetzt habe ich alle Waren, die ich benötige. Hier ist das Geld für Eure {s6}, und noch ein kleiner Bonus für Eure Hilfe. Ich fürchte, dass ich Euch weder für zusätzliche Waren, noch für gefangene Plünderer bezahlen kann. Wenn Ihr die restlichen Bastarde jedoch zur Strecke bringen wollt, so tut Euch keinen Zwang an. Vielen Dank für Eure Hilfe, ich werde es nicht vergessen.
dlga_mayor_begin:close_window|Gut, Euch wieder zu sehen, {playername}. Ich habe gehört, dass Ihr die Rinder erfolgreich abgeliefert habt. Ich werde den Händlern mitteilen, wie verlässlich Ihr seid. Und hier ist Eure Bezahlung, {reg8} Dinare.
dlga_mayor_begin:move_cattle_herd_failed|Ich hörte, dass Euch auf dem Weg nach {s9} eine Rinderherde abhanden gekommen ist. Ich hatte große Schwierigkeiten, Euer Versagen dem Besitzer der Herde zu erklären, {mein Herr/meine Dame}. Habt Ihr mir irgendetwas zu sagen?
dlga_move_cattle_herd_failed:move_cattle_herd_failed_2|Es tut mir Leid, doch ich wurde unterwegs angegriffen.
dlga_move_cattle_herd_failed:move_cattle_herd_failed_2.1|Es tut mir Leid. Diese dummen Rindviecher sind in der Nacht einfach davongelaufen.
dlga_move_cattle_herd_failed_2:merchant_ask_for_debts|Nun, trotzdem war es Eure Verantwortung, die Herde um jeden Preis sicher abzuliefern. Ihr solltet wissen, dass der Besitzer der Herde eine Entschädigung für seinen Verlust verlangt hat, und dass ich ihm 100 Dinare zahlen musste. Jetzt also schuldet Ihr mir diesen Betrag!
dlga_mayor_begin:close_window.1|Oh {playername}. Ich stehe in Eurer Schuld, da Ihr die Tochter meines Freundes zurückgebracht habt. Bitte nehmt diese {reg8} Dinare, ich Euch versprochen hatte. Mein Freund wünschte, er könnte Euch mehr geben, doch das Lösegeld hat seine Mittel erschöpft.
dlga_mayor_begin:mayor_friendly_pretalk|Ich habe von Euren Taten gehört. Ihr habt diesen Banditen ihre gerechte Strafe zukommen lassen. Ihr seid wirklich so gut tüchtig, wie man sich sagt. Hier ist Eure Belohnung: {reg5} Dinare. Ich würde Euch gerne mehr geben, doch dank dieser Banditen bin ich nun fast mittellos.
dlga_mayor_begin:merchant_ask_for_debts|Meinen Büchern zufolge schuldet Ihr der Handelsgilde {reg1} Dinare. Das werde ich besser jetzt gleich kassieren.
dlga_merchant_ask_for_debts:merchant_debts_paid|In Ordnung. Ich werde meine Schulden bei Euch bezahlen.
dlga_merchant_debts_paid:mayor_pretalk|Ausgezeichnet. Ich werde meine Händlerkollegen wissen lassen, dass Ihr nun schuldenfrei seid.
dlga_merchant_ask_for_debts:merchant_debts_not_paid|Ich fürchte, ich kann diese Summe momentan nicht aufbringen.
dlga_merchant_debts_not_paid:close_window|Wenn das so ist, kann ich mit Euch leider keine Geschäfte machen. Gildenregularien... Kommt zurück, wenn Ihr die {reg1} Dinare bezahlen könnt. Und vergesst nicht, dass wir Euch Zinsen auf Eure Schulden berechnen werden. Je früher Ihr sie zahlt, desto besser für Euch.
dlga_mayor_begin:mayor_talk|Was kann ich für Euch tun?
dlga_mayor_friendly_pretalk:mayor_talk|Nun ... was kann ich sonst noch für Euch tun?
dlga_mayor_pretalk:mayor_talk|Ja?
dlga_mayor_talk:mayor_info_begin|Könnt Ihr mir etwas über Eure Tätigkeit erzählen?
dlga_mayor_talk:merchant_quest_requested|Habt Ihr vielleicht einen Auftrag für mich?
dlga_mayor_talk:merchant_quest_last_offered_job|Wegen des Auftrags, den Ihr mir angeboten hattet ...
dlga_mayor_talk:merchant_quest_about_job|Wegen des Auftrags, den Ihr mir gegeben hattet ...
dlga_mayor_talk:close_window|[Weiterziehen]
dlga_mayor_info_begin:mayor_info_talk|Ich bin der Gildenmeister von {s9}. Man kann sagen, dass ich der Anführer der guten Leute von {s9} bin. Wenn Ihr ehrliche Arbeit sucht, kann ich Euch dabei behilflich sein.
dlga_mayor_info_talk:mayor_info_lord|Wer regiert diese Stadt?
dlga_mayor_info_lord:mayor_info_talk|Der Fürst und Schutzherr dieser Stadt ist {s10}. Er besitzt die Burg und verweilt manchmal hier, um die Steuern der Stadt einzutreiben. Die den meisten Belangen regieren wir uns jedoch selbst. Als Gildenmeister der Stadt habe ich die Autorität, über derartige Angelegenheiten zu entscheiden.
dlga_mayor_info_talk:mayor_pretalk|Mehr muss ich nicht wissen. Danke.
dlga_merchant_quest_about_job:merchant_quest_about_job_2|Was ist damit?
dlga_merchant_quest_about_job_2:merchant_quest_what_if_fail|Was ist, wenn ich ihn nicht erfüllen kann?
dlga_merchant_quest_about_job_2:merchant_quest_about_job_working|Nun, ich arbeite noch daran.
dlga_merchant_quest_about_job_working:mayor_pretalk|Gut. Ich bin mir sicher, dass Ihr es schaffen könnt.
dlga_merchant_quest_last_offered_job:merchant_quest_brief|Oh, das solltet Ihr Euch das vielleicht nochmal überlegen. Gut ...
dlga_merchant_quest_what_if_fail:mayor_pretalk|Hoffentlich werdet Ihr nicht scheitern. Falls doch, so muss ich um das Geld für die Ladung bitten, die Ihr transportiert habt.
dlga_merchant_quest_what_if_fail:mayor_pretalk.1|Nun, gebt Euer Bestes, um den Auftrag zu erfüllen.
dlga_merchant_quest_taken:mayor_pretalk|Ausgezeichnet. Dann zähle ich auf Euch. Viel Glück.
dlga_merchant_quest_stall:mayor_pretalk|Nun, der Auftrag wird wohl noch ein paar Tage länger offen sein .... sucht mich auf, wenn Ihr ihn haben wollt.
dlga_merchant_quest_requested:merchant_quest_brief|Wohlan, Ihr seht tüchtig genug aus. Ich glaube, ich hätte da einen Auftrag für Euch.
dlga_merchant_quest_brief:merchant_quest_looters_choice|In der Nähe von {s5} gab es kürzlich einige Kämpfe mit dem einhergehenden Chaos. Dies hat einige unserer weniger rechtschaffenen Bewohner versucht, sich die Unruhe zunutze zu machen, und Läden wie Bauernhöfe zu plündern. Ich brauche jemanden, der die gestohlenen Güter zurückbringen und diesen Bastarden eine Lektion erteilen kann. Das klingt doch nach einem Auftrag für Euch, nicht wahr?
dlga_merchant_quest_looters_choice:merchant_quest_looters_brief|Sehr gut, ich nehme ihn.
dlga_merchant_quest_looters_choice:merchant_quest_stall|Ich fürchte, ich kann den Auftrag momentan nicht annehmen.
dlga_merchant_quest_looters_brief:close_window|Vortrefflich! Die Plünderer streifen durchs Land, und Ihr werdet sie wahrscheinlich beim Versuch erwischen, andere rechtschaffene Leute auszurauben. Tötet oder fangt diese Bastarde – es kümmert mich nicht, was Ihr mit ihnen macht. Ich werde Euch für jede vernichtete Plündererbande mit 40 Dinaren belohnen, bis keiner von ihnen mehr sein Unwesen treibt.
dlga_merchant_quest_requested:merchant_quest_brief.1|Sucht Ihr nach Arbeit? Ich suche gerade nach jemandem, der einige {s4} für mich liefern kann. Vielleicht wäre das etwas für Euch?
dlga_merchant_quest_brief:merchant_quest_brief_deliver_wine|Ich habe eine Ladung {s6}, die in die Schänke von {s4} geliefert werden muss. Wenn Ihr {reg5} Einheiten {s6} in 7 Tagen nach {s4} bringen könnt, würdet Ihr dadurch {reg8} Dinare verdienen. Was sagt Ihr dazu?
dlga_merchant_quest_brief_deliver_wine:merchant_quest_taken|In Ordnung. Ich werde die Lieferung übernehmen.
dlga_merchant_quest_brief_deliver_wine:merchant_quest_stall|Ich fürchte, so eine schwere Ladung kann ich momentan nicht transportieren.
dlga_merchant_quest_requested:merchant_quest_brief.2|Sucht Ihr nach Arbeit? Ich suche gerade nach jemandem, der eine Karawane eskortieren kann. Vielleicht wäre das etwas für Euch?
dlga_merchant_quest_brief:escort_merchant_caravan_quest_brief|Ich werde eine Karawane mit Waren nach {s8} entsenden. Angesichts all dieser Banditen und Deserteure auf den Straßen möchte ich sie allerdings nicht schutzlos reisen lassen. Wenn Ihr diese Karawane in 15 Tagen nach {s8} eskortieren könnt, werdet Ihr Euch {reg8} Dinare verdienen. Natürlich muss Euer Trupp mindestens aus {reg4} Mann bestehen, um ihnen Schutz bieten zu können.
dlga_escort_merchant_caravan_quest_brief:merchant_quest_taken|In Ordnung. Ich werde die Karawane eskortieren.
dlga_escort_merchant_caravan_quest_brief:merchant_quest_stall|Ich fürchte, ich habe momentan nicht genügend Soldaten bei mir.
dlga_escort_merchant_caravan_quest_brief:merchant_quest_stall.1|Vergebt mir. Ich kann das momentan nicht tun.
dlga_start:close_window.19|Wir können den restlichen Weg alleine bewerkstelligen. Danke.
dlga_start:close_window.20|Wohlan, wir haben {s21} fast erreicht. Wir können den restlichen Weg alleine bewerkstelligen. Hier ist Eure Bezahlung ... {reg14} Dinare. Vielen Dank für Eure Eskorte. Viel Glück.
dlga_start:merchant_caravan_intro_1|Seid gegrüßt. Ihr seid unsere Eskorte, richtig?
dlga_merchant_caravan_intro_1:merchant_caravan_intro_2|Jawohl. Mein Name lautet {playername}. Ich werde Euch nach {s1} geleiten.
dlga_merchant_caravan_intro_2:escort_merchant_caravan_talk|Wohlan, es ist gut zu wissen, dass wir nicht alleine reisen werden. Wie lauten Eure Anweisungen für uns?
dlga_start:escort_merchant_caravan_talk|Wir haben es bis hierher geschafft ... wie lauten Eure Anweisungen für uns?
dlga_escort_merchant_caravan_talk:merchant_caravan_follow_lead|Folgt mir. Ich werde Euch entlang einer sicheren Route führen.
dlga_merchant_caravan_follow_lead:close_window|In Ordnung. Wir sind direkt hinter Euch.
dlga_escort_merchant_caravan_talk:merchant_caravan_stay_here|Bleibt eine Weile hier. Ich reite voraus und überprüfe die Straße.
dlga_merchant_caravan_stay_here:close_window|In Ordnung. Wir werden hier auf Euch warten.
dlga_merchant_quest_requested:merchant_quest_brief.3|Einen tüchtigen Abenteurer wie Euch suche ich schon lange: Eine Bande besonders schlimmer Banditen hat sich in der Nähe unserer Stadt eingenistet und bedroht meine Karawanen. Bis jetzt konnten sie den Soldaten und Milizen entkommen. Wenn sie nicht bald jemand zur Strecke bringt, werde ich ruiniert sein ...
dlga_merchant_quest_brief:troublesome_bandits_quest_brief|Wenn Ihr diese lästigen Banditen zur Strecke bringt, werden wir Euch {reg8} Dinare zahlen. Es ist ein gefährliches Unterfangen, doch ich glaube, dass Ihr dafür geeignet seid. Was sagt Ihr dazu?
dlga_troublesome_bandits_quest_brief:merchant_quest_taken_bandits|In Ordnung. Ich werde diese Banditen zur Strecke bringen.
dlga_merchant_quest_taken_bandits:close_window|Tatsächlich? Ich freue mich so, das zu hören. Ich wünsche Euch viel Glück!
dlga_troublesome_bandits_quest_brief:merchant_quest_stall|Vergebt mir. Ich habe dafür momentan keine Zeit.
dlga_merchant_quest_requested:merchant_quest_brief.4|Ich war schon lange auf der Suche nach einem verlässlichen {Mann/Helfer}, der eine wichtige Mission für mich durchführen kann: Eine Gruppe Banditen hat die Tochter eines Freundes entführt und hält sie als Geisel. Mein Freund wird das Lösegeld zahlen, doch wir benötigen noch jemand, der es diesen Gaunern übergibt und das Mädchen sicher zurückbringt.
